{
  "schema_version": 1,
  "definition": {
    "name": "documentation-consistency",
    "content_hash": "0f63eafd9b718960c7169166cbc9551588f31a28ddb6a65b62e2626ec9d0380f"
  },
  "profile": {
    "id": "documentation-consistency-exploration",
    "content_hash": "effe914d221fb374518cfddcf30f6f6076464d561d2e91a8dff6c4538d6153b2"
  },
  "dataset": {
    "id": "documentation-consistency-cases",
    "revision": "repository-exploration-1",
    "content_hash": "2906c9849dc7a405c7d11d256e32de5ce2d3ec8a6d0792027832e92a3a9a88e6"
  },
  "purpose": "exploration",
  "cases": [
    {
      "id": "unicode-original",
      "input_hash": "0080bccacd937b5108093f8a409644e916330e91beb77f0972771fc73c635385",
      "outcomes": {
        "requirement": "review"
      },
      "aggregate": "review",
      "completion": "completed",
      "reference_match": {
        "requirement": false
      }
    },
    {
      "id": "cutoffs-original",
      "input_hash": "578613d6b22f68b36aa6f2896e1c7506ce7dc890c60be02397987d593db77f1c",
      "outcomes": {
        "requirement": "review"
      },
      "aggregate": "review",
      "completion": "completed",
      "reference_match": {
        "requirement": false
      }
    },
    {
      "id": "shadow-original",
      "input_hash": "7c74328d4556720d5a5ed10dc3357ff47f504353c60d4237f4bffb443804b165",
      "outcomes": {
        "requirement": "review"
      },
      "aggregate": "review",
      "completion": "completed",
      "reference_match": {
        "requirement": false
      }
    },
    {
      "id": "unicode-mutated",
      "input_hash": "c3d0ab9ce7ca055220dcb20348946708832858567aca22d3561c1db5869b0bf5",
      "outcomes": {
        "requirement": "fail"
      },
      "aggregate": "fail",
      "completion": "completed",
      "reference_match": {
        "requirement": true
      }
    },
    {
      "id": "cutoffs-mutated",
      "input_hash": "8ef7755392ab812afaeccd23e27a7c1bd7814cb474a2a26d020edef00466d14a",
      "outcomes": {
        "requirement": "fail"
      },
      "aggregate": "fail",
      "completion": "completed",
      "reference_match": {
        "requirement": true
      }
    },
    {
      "id": "default-evidence-omitted",
      "input_hash": "b40366cbf7b80fb94b9602e14212c975feae01dece87dbc339bca9c70b139502",
      "outcomes": {
        "requirement": "review"
      },
      "aggregate": "review",
      "completion": "completed",
      "reference_match": {
        "requirement": true
      }
    }
  ],
  "metrics": [
    {
      "scope": "requirement",
      "counts": {
        "pass": 0,
        "fail": 2,
        "review": 4,
        "error": 0,
        "skipped": 0
      },
      "rates": [
        {
          "metric": "false_acceptance_rate",
          "numerator": 0,
          "denominator": 3,
          "value": 0
        },
        {
          "metric": "error_among_accepted",
          "numerator": 0,
          "denominator": 0,
          "value": null
        },
        {
          "metric": "false_rejection_rate",
          "numerator": 0,
          "denominator": 3,
          "value": 0
        },
        {
          "metric": "review_rate",
          "numerator": 4,
          "denominator": 6,
          "value": 0.6666666666666666
        },
        {
          "metric": "automatic_coverage",
          "numerator": 2,
          "denominator": 6,
          "value": 0.3333333333333333
        },
        {
          "metric": "label_coverage",
          "numerator": 6,
          "denominator": 6,
          "value": 1
        }
      ]
    },
    {
      "scope": "all_checks",
      "counts": {
        "pass": 0,
        "fail": 2,
        "review": 4,
        "error": 0,
        "skipped": 0
      },
      "rates": [
        {
          "metric": "false_acceptance_rate",
          "numerator": 0,
          "denominator": 3,
          "value": 0
        },
        {
          "metric": "error_among_accepted",
          "numerator": 0,
          "denominator": 0,
          "value": null
        },
        {
          "metric": "false_rejection_rate",
          "numerator": 0,
          "denominator": 3,
          "value": 0
        },
        {
          "metric": "review_rate",
          "numerator": 4,
          "denominator": 6,
          "value": 0.6666666666666666
        },
        {
          "metric": "automatic_coverage",
          "numerator": 2,
          "denominator": 6,
          "value": 0.3333333333333333
        },
        {
          "metric": "label_coverage",
          "numerator": 6,
          "denominator": 6,
          "value": 1
        }
      ]
    }
  ],
  "slices": [
    {
      "tag": "starter",
      "metrics": [
        {
          "scope": "requirement",
          "counts": {
            "pass": 0,
            "fail": 2,
            "review": 4,
            "error": 0,
            "skipped": 0
          },
          "rates": [
            {
              "metric": "false_acceptance_rate",
              "numerator": 0,
              "denominator": 3,
              "value": 0
            },
            {
              "metric": "error_among_accepted",
              "numerator": 0,
              "denominator": 0,
              "value": null
            },
            {
              "metric": "false_rejection_rate",
              "numerator": 0,
              "denominator": 3,
              "value": 0
            },
            {
              "metric": "review_rate",
              "numerator": 4,
              "denominator": 6,
              "value": 0.6666666666666666
            },
            {
              "metric": "automatic_coverage",
              "numerator": 2,
              "denominator": 6,
              "value": 0.3333333333333333
            },
            {
              "metric": "label_coverage",
              "numerator": 6,
              "denominator": 6,
              "value": 1
            }
          ]
        },
        {
          "scope": "all_checks",
          "counts": {
            "pass": 0,
            "fail": 2,
            "review": 4,
            "error": 0,
            "skipped": 0
          },
          "rates": [
            {
              "metric": "false_acceptance_rate",
              "numerator": 0,
              "denominator": 3,
              "value": 0
            },
            {
              "metric": "error_among_accepted",
              "numerator": 0,
              "denominator": 0,
              "value": null
            },
            {
              "metric": "false_rejection_rate",
              "numerator": 0,
              "denominator": 3,
              "value": 0
            },
            {
              "metric": "review_rate",
              "numerator": 4,
              "denominator": 6,
              "value": 0.6666666666666666
            },
            {
              "metric": "automatic_coverage",
              "numerator": 2,
              "denominator": 6,
              "value": 0.3333333333333333
            },
            {
              "metric": "label_coverage",
              "numerator": 6,
              "denominator": 6,
              "value": 1
            }
          ]
        }
      ]
    }
  ],
  "operational": {
    "errors": [],
    "attempts": 0,
    "usage": {
      "input_tokens": 3662,
      "output_tokens": 294
    }
  }
}
